{
    "$schema": "./node_modules/feng3d-cli/schemas/feng3d.schema.json",
    "name": "{{name}}",
    "eslint": {
        "enabled": true,
        "ignores": [],
        "rules": {}
    },
    "vitest": {
        "enabled": true,
        "testTimeout": 0
    },
    "typedoc": {
        "enabled": true,
        "outDir": "public"
    },
    "oss": {
        "localDir": "./public",
        "ossDir": ""
    },
    "templates": {
        "examples": true,
        "test": true
    }
}

